{
  "$schema": "../surah.schema.json",
  "number": 106,
  "nameArabic": "قريش",
  "nameEnglish": "Quraysh",
  "meaningEnglish": "Quraysh",
  "ayahs": [
    { "verseKey": "106:1", "surahNumber": 106, "ayahNumber": 1, "textQpcHafs": "لِإِيلَـٰفِ قُرَيْشٍ" },
    { "verseKey": "106:2", "surahNumber": 106, "ayahNumber": 2, "textQpcHafs": "إِۦلَـٰفِهِمْ رِحْلَةَ ٱلشِّتَآءِ وَٱلصَّيْفِ" },
    { "verseKey": "106:3", "surahNumber": 106, "ayahNumber": 3, "textQpcHafs": "فَلْيَعْبُدُوا۟ رَبَّ هَـٰذَا ٱلْبَيْتِ" },
    { "verseKey": "106:4", "surahNumber": 106, "ayahNumber": 4, "textQpcHafs": "ٱلَّذِىٓ أَطْعَمَهُم مِّن جُوعٍ وَءَامَنَهُم مِّنْ خَوْفٍۭ" }
  ]
}
