{
  "$schema": "../surah.schema.json",
  "number": 94,
  "nameArabic": "الشرح",
  "nameEnglish": "Ash-Sharh",
  "meaningEnglish": "The Relief",
  "ayahs": [
    { "verseKey": "94:1", "surahNumber": 94, "ayahNumber": 1, "textQpcHafs": "أَلَمْ نَشْرَحْ لَكَ صَدْرَكَ" },
    { "verseKey": "94:2", "surahNumber": 94, "ayahNumber": 2, "textQpcHafs": "وَوَضَعْنَا عَنكَ وِزْرَكَ" },
    { "verseKey": "94:3", "surahNumber": 94, "ayahNumber": 3, "textQpcHafs": "ٱلَّذِىٓ أَنقَضَ ظَهْرَكَ" },
    { "verseKey": "94:4", "surahNumber": 94, "ayahNumber": 4, "textQpcHafs": "وَرَفَعْنَا لَكَ ذِكْرَكَ" },
    { "verseKey": "94:5", "surahNumber": 94, "ayahNumber": 5, "textQpcHafs": "فَإِنَّ مَعَ ٱلْعُسْرِ يُسْرًا" },
    { "verseKey": "94:6", "surahNumber": 94, "ayahNumber": 6, "textQpcHafs": "إِنَّ مَعَ ٱلْعُسْرِ يُسْرًا" },
    { "verseKey": "94:7", "surahNumber": 94, "ayahNumber": 7, "textQpcHafs": "فَإِذَا فَرَغْتَ فَٱنصَبْ" },
    { "verseKey": "94:8", "surahNumber": 94, "ayahNumber": 8, "textQpcHafs": "وَإِلَىٰ رَبِّكَ فَٱرْغَب" }
  ]
}
