{
  "$schema": "../surah.schema.json",
  "number": 114,
  "nameArabic": "الناس",
  "nameEnglish": "An-Nas",
  "meaningEnglish": "Mankind",
  "ayahs": [
    { "verseKey": "114:1", "surahNumber": 114, "ayahNumber": 1, "textQpcHafs": "قُلْ أَعُوذُ بِرَبِّ ٱلنَّاسِ" },
    { "verseKey": "114:2", "surahNumber": 114, "ayahNumber": 2, "textQpcHafs": "مَلِكِ ٱلنَّاسِ" },
    { "verseKey": "114:3", "surahNumber": 114, "ayahNumber": 3, "textQpcHafs": "إِلَـٰهِ ٱلنَّاسِ" },
    { "verseKey": "114:4", "surahNumber": 114, "ayahNumber": 4, "textQpcHafs": "مِن شَرِّ ٱلْوَسْوَاسِ ٱلْخَنَّاسِ" },
    { "verseKey": "114:5", "surahNumber": 114, "ayahNumber": 5, "textQpcHafs": "ٱلَّذِى يُوَسْوِسُ فِى صُدُورِ ٱلنَّاسِ" },
    { "verseKey": "114:6", "surahNumber": 114, "ayahNumber": 6, "textQpcHafs": "مِنَ ٱلْجِنَّةِ وَٱلنَّاسِ" }
  ]
}
