{
  "$schema": "../surah.schema.json",
  "number": 98,
  "nameArabic": "البينة",
  "nameEnglish": "Al-Bayyinah",
  "meaningEnglish": "The Clear Proof",
  "ayahs": [
    { "verseKey": "98:1", "surahNumber": 98, "ayahNumber": 1, "textQpcHafs": "لَمْ يَكُنِ ٱلَّذِينَ كَفَرُوا۟ مِنْ أَهْلِ ٱلْكِتَـٰبِ وَٱلْمُشْرِكِينَ مُنفَكِّينَ حَتَّىٰ تَأْتِيَهُمُ ٱلْبَيِّنَةُ" },
    { "verseKey": "98:2", "surahNumber": 98, "ayahNumber": 2, "textQpcHafs": "رَسُولٌ مِّنَ ٱللَّهِ يَتْلُوا۟ صُحُفًا مُّطَهَّرَةً" },
    { "verseKey": "98:3", "surahNumber": 98, "ayahNumber": 3, "textQpcHafs": "فِيهَا كُتُبٌ قَيِّمَةٌ" },
    { "verseKey": "98:4", "surahNumber": 98, "ayahNumber": 4, "textQpcHafs": "وَمَا تَفَرَّقَ ٱلَّذِينَ أُوتُوا۟ ٱلْكِتَـٰبَ إِلَّا مِنۢ بَعْدِ مَا جَآءَتْهُمُ ٱلْبَيِّنَةُ" },
    { "verseKey": "98:5", "surahNumber": 98, "ayahNumber": 5, "textQpcHafs": "وَمَآ أُمِرُوٓا۟ إِلَّا لِيَعْبُدُوا۟ ٱللَّهَ مُخْلِصِينَ لَهُ ٱلدِّينَ حُنَفَآءَ وَيُقِيمُوا۟ ٱلصَّلَوٰةَ وَيُؤْتُوا۟ ٱلزَّكَوٰةَ ۚ وَذَٰلِكَ دِينُ ٱلْقَيِّمَةِ" },
    { "verseKey": "98:6", "surahNumber": 98, "ayahNumber": 6, "textQpcHafs": "إِنَّ ٱلَّذِينَ كَفَرُوا۟ مِنْ أَهْلِ ٱلْكِتَـٰبِ وَٱلْمُشْرِكِينَ فِى نَارِ جَهَنَّمَ خَـٰلِدِينَ فِيهَآ ۚ أُو۟لَـٰٓئِكَ هُمْ شَرُّ ٱلْبَرِيَّةِ" },
    { "verseKey": "98:7", "surahNumber": 98, "ayahNumber": 7, "textQpcHafs": "إِنَّ ٱلَّذِينَ ءَامَنُوا۟ وَعَمِلُوا۟ ٱلصَّـٰلِحَـٰتِ أُو۟لَـٰٓئِكَ هُمْ خَيْرُ ٱلْبَرِيَّةِ" },
    { "verseKey": "98:8", "surahNumber": 98, "ayahNumber": 8, "textQpcHafs": "جَزَآؤُهُمْ عِندَ رَبِّهِمْ جَنَّـٰتُ عَدْنٍ تَجْرِى مِن تَحْتِهَا ٱلْأَنْهَـٰرُ خَـٰلِدِينَ فِيهَآ أَبَدًا ۖ رَّضِىَ ٱللَّهُ عَنْهُمْ وَرَضُوا۟ عَنْهُ ۚ ذَٰلِكَ لِمَنْ خَشِىَ رَبَّهُۥ" }
  ]
}
